{"schemaVersion":"1.0.0","eventId":"aws-7616752a676831bca4a1a804a5f367c0","eventOriginalId":"4e1d2b9a-0000-4000-8000-000000000002","timeGenerated":"2026-07-26T02:09:00+00:00","timeObserved":"2026-07-26T02:14:19+00:00","eventCategory":"administrative-activity","eventType":"aws_cloudtrail","eventAction":"StopLogging","eventResult":"success","eventSeverity":"medium","application":{"name":"aws-security","environment":"production","tenantId":"123456789012"},"actor":{"userId":"arn:aws:sts::123456789012:assumed-role/Admin/alice","username":"Admin","type":"service"},"target":{"type":"aws-api","name":"cloudtrail.amazonaws.com"},"source":{"ipAddress":"198.51.100.7"},"collector":{"id":"aws:test","version":"0.1.0","sourceAdapter":"aws.cloudtrail","configurationHash":"62c50ba2727df190","receivedAt":"2026-07-26T02:14:19+00:00"},"labels":{"aws.service":"cloudtrail.amazonaws.com","aws.eventName":"StopLogging","aws.identityType":"AssumedRole","aws.source":"cloudtrail","aws.readOnly":"false","aws.sourceId":"aws:test","bower.fingerprint":"7616752a676831bca4a1a804a5f367c0afc4f37a37c5a83f42b75a39d0935ef2","aws.region":"ap-southeast-2","aws.accountId":"123456789012"}}