{"schemaVersion":"1.0.0","eventId":"gcp-15459fc62cf93c9562307f0f167b36da","eventOriginalId":"abc123","timeGenerated":"2026-07-26T02:09:00+00:00","timeObserved":"2026-07-26T02:14:19+00:00","eventCategory":"administrative-activity","eventType":"gcp_cloud_audit","eventAction":"google.iam.admin.v1.CreateServiceAccountKey","eventResult":"success","eventSeverity":"medium","application":{"name":"gcp-security","environment":"production","tenantId":"bower-prod"},"actor":{"username":"alice@example.com","type":"human"},"target":{"type":"service_account","name":"projects/-/serviceAccounts/123"},"source":{"ipAddress":"203.0.113.20"},"collector":{"id":"gcp:test","version":"0.1.0","sourceAdapter":"gcp.audit","configurationHash":"d2e5d68a2718ad6a","receivedAt":"2026-07-26T02:14:19+00:00"},"labels":{"gcp.source":"cloud-audit","gcp.service":"iam.googleapis.com","gcp.method":"google.iam.admin.v1.CreateServiceAccountKey","gcp.logName":"projects/bower-prod/logs/cloudaudit.googleapis.com/activity","gcp.auditLog":"activity","gcp.projectId":"bower-prod","gcp.severity":"NOTICE","gcp.sourceId":"gcp:test","bower.fingerprint":"15459fc62cf93c9562307f0f167b36da9705366b6dd9f5ce0b1fbb7c18410b4d"}}