{"schemaVersion":"1.0.0","eventId":"gcp-9b47aee7ec6021b60f93cd1ed0adbc90","eventOriginalId":"organizations/1/sources/2/findings/f1","timeGenerated":"2026-07-26T02:00:00+00:00","timeObserved":"2026-07-26T02:14:19+00:00","eventCategory":"application-security","eventType":"gcp_scc_finding","eventAction":"OPEN_FIREWALL","eventResult":"failure","eventSeverity":"high","eventOutcomeReason":"ACTIVE","application":{"name":"gcp-security","environment":"production","tenantId":"bower-prod"},"target":{"type":"google.compute.Instance","name":"//compute.googleapis.com/projects/bower-prod/zones/australia-southeast1-a/instances/vm1"},"collector":{"id":"gcp:test","version":"0.1.0","sourceAdapter":"gcp.scc","configurationHash":"d2e5d68a2718ad6a","receivedAt":"2026-07-26T02:14:19+00:00"},"labels":{"gcp.source":"security-command-center","gcp.category":"OPEN_FIREWALL","gcp.state":"ACTIVE","gcp.findingName":"organizations/1/sources/2/findings/f1","gcp.findingClass":"MISCONFIGURATION","gcp.mute":"UNMUTED","gcp.projectId":"bower-prod","gcp.notificationConfig":"organizations/1/notificationConfigs/bower","gcp.severity":"HIGH","gcp.sourceId":"gcp:test","bower.fingerprint":"9b47aee7ec6021b60f93cd1ed0adbc905353020ffc233c871d2d583def94ae04"}}