{"schemaVersion":"1.0.0","eventId":"aws-6659f1d4d8b18a30a36f394aac8c7267","eventOriginalId":"a1b2c3","timeGenerated":"2026-07-26T02:05:00+00:00","timeObserved":"2026-07-26T02:14:19+00:00","eventCategory":"application-security","eventType":"aws_guardduty","eventAction":"UnauthorizedAccess:IAMUser/InstanceCredentialExfiltration.OutsideAWS","eventResult":"failure","eventSeverity":"high","eventOutcomeReason":"Credentials for instance role used from external IP","application":{"name":"aws-security","environment":"production","tenantId":"123456789012"},"target":{"type":"finding","name":"UnauthorizedAccess:IAMUser/InstanceCredentialExfiltration.OutsideAWS"},"collector":{"id":"aws:test","version":"0.1.0","sourceAdapter":"aws.guardduty","configurationHash":"f951ddde2dacf3b9","receivedAt":"2026-07-26T02:14:19+00:00"},"labels":{"aws.source":"guardduty","aws.findingType":"UnauthorizedAccess:IAMUser/InstanceCredentialExfiltration.OutsideAWS","aws.severity":"8","aws.sourceId":"aws:test","bower.fingerprint":"6659f1d4d8b18a30a36f394aac8c72675e6c896e9551574e55e5f828769ed760","aws.region":"ap-southeast-2","aws.accountId":"123456789012"}}