{"schemaVersion":"1.0.0","eventId":"s=7a1c;i=1f01;b=55aa;m=91;t=63e2;x=c3","eventOriginalId":"s=7a1c;i=1f01;b=55aa;m=91;t=63e2;x=c3","timeGenerated":"2026-10-26T01:02:03+00:00","eventCategory":"authentication","eventType":"authentication_failure","eventAction":"authentication.attempt","eventResult":"failure","eventSeverity":"medium","eventOutcomeReason":"InvalidCredentials","application":{"name":"linux-sshd","environment":"production"},"actor":{"username":"deploy-admin","type":"human"},"source":{"ipAddress":"203.0.113.5"}}