{"schemaVersion":"1.0.0","eventId":"bundle-diff-2","timeGenerated":"2026-10-17T01:00:00+00:00","application":{"name":"aws-security","environment":"production","tenantId":"123456789012"},"eventCategory":"administrative-activity","eventType":"aws_cloudtrail","eventAction":"CreateAccessKey","eventResult":"success","eventOutcomeReason":"created AKIAIOSFODNN7EXAMPLE","actor":{"username":"Admin","type":"service"},"target":{"type":"aws-api","name":"iam.amazonaws.com"},"source":{"ipAddress":"198.51.100.7"}}
