{"schemaVersion":"1.0.0","eventId":"aws-bcfe96ff1c9fcf41ae36b1aa1ea26dd8","eventOriginalId":"arn:aws:securityhub:ap-southeast-2:123456789012:finding/1","timeGenerated":"2026-07-26T02:00:00+00:00","timeObserved":"2026-07-26T02:14:19+00:00","eventCategory":"application-security","eventType":"aws_security_hub","eventAction":"S3 general purpose buckets should block public access","eventResult":"failure","eventSeverity":"high","eventOutcomeReason":"FAILED","application":{"name":"aws-security","environment":"production","tenantId":"123456789012"},"target":{"type":"finding","name":"arn:aws:securityhub:ap-southeast-2::product/aws/securityhub"},"collector":{"id":"aws:test","version":"0.1.0","sourceAdapter":"aws.securityhub","configurationHash":"ad25236684059416","receivedAt":"2026-07-26T02:14:19+00:00"},"labels":{"aws.source":"securityhub","aws.productArn":"arn:aws:securityhub:ap-southeast-2::product/aws/securityhub","aws.compliance":"FAILED","aws.sourceId":"aws:test","bower.fingerprint":"bcfe96ff1c9fcf41ae36b1aa1ea26dd8b317b254066e99994096448cf4aee616","aws.region":"ap-southeast-2","aws.accountId":"123456789012"}}