{"schemaVersion":"1.0.0","eventId":"bundle-diff-1","timeGenerated":"2026-10-17T01:00:00+00:00","application":{"name":"aws-security","environment":"production","tenantId":"123456789012"},"eventCategory":"authentication","eventType":"aws_cloudtrail","eventAction":"ConsoleLogin","eventResult":"failure","eventOutcomeReason":"Failed authentication","actor":{"username":"root","userId":"arn:aws:iam::123456789012:root","type":"human"},"target":{"type":"aws-api","name":"signin.amazonaws.com"},"source":{"ipAddress":"203.0.113.10"},"labels":{"aws.identityType":"Root","aws.eventName":"ConsoleLogin"}}
