{"schemaVersion":"1.0.0","eventId":"aws-407a2a0aabf5e672a6613f125e19f6b9","eventOriginalId":"4e1d2b9a-0000-4000-8000-000000000001","timeGenerated":"2026-07-26T02:09:59+00:00","timeObserved":"2026-07-26T02:14:19+00:00","eventCategory":"authentication","eventType":"aws_cloudtrail","eventAction":"ConsoleLogin","eventResult":"failure","eventSeverity":"medium","eventOutcomeReason":"Failed authentication","application":{"name":"aws-security","environment":"production","tenantId":"123456789012"},"actor":{"userId":"arn:aws:iam::123456789012:root","username":"root","type":"human"},"target":{"type":"aws-api","name":"signin.amazonaws.com"},"source":{"ipAddress":"203.0.113.10"},"collector":{"id":"aws:test","version":"0.1.0","sourceAdapter":"aws.cloudtrail","configurationHash":"62c50ba2727df190","receivedAt":"2026-07-26T02:14:19+00:00"},"labels":{"aws.service":"signin.amazonaws.com","aws.eventName":"ConsoleLogin","aws.identityType":"Root","aws.source":"cloudtrail","aws.mfaUsed":"No","aws.readOnly":"false","aws.sourceId":"aws:test","bower.fingerprint":"407a2a0aabf5e672a6613f125e19f6b9c129700aca8864e5d1278628e36a6e0d","aws.region":"us-east-1","aws.accountId":"123456789012"}}